{
 "$schema": "https://json-schema.org/draft/2020-12/schema",
 "$id": "https://example.invalid/imperial-dragon-harness/adapters/pilot-support.schema.json",
 "title": "IDH adapter pilot evidence inventory",
 "description": "What one hand-ported skill slice actually proved on each harness, and how. Ticket 0802 owns this schema and its first entries; later slices append to the same arrays; ticket 0810 validates. Version support is a floor plus a probe, never an enumerated allowlist -- an allowlist revokes support on every upstream release.",
 "type": "object",
 "additionalProperties": false,
 "required": [
  "schema_version",
  "canonical_sources",
  "versions",
  "assertions"
 ],
 "properties": {
  "schema_version": {
   "const": 1
  },
  "canonical_sources": {
   "type": "object",
   "description": "slice name -> the one live body, repo-relative.",
   "minProperties": 1,
   "additionalProperties": {
    "type": "string",
    "minLength": 1
   }
  },
  "versions": {
   "type": "array",
   "minItems": 1,
   "items": {
    "$ref": "#/$defs/version"
   }
  },
  "assertions": {
   "type": "array",
   "minItems": 1,
   "items": {
    "$ref": "#/$defs/assertion"
   }
  }
 },
 "$defs": {
  "version": {
   "type": "object",
   "additionalProperties": false,
   "required": [
    "harness",
    "minimum_version",
    "probed_version",
    "probed_on",
    "probe_command",
    "unknown_version_behavior",
    "below_minimum_behavior",
    "skills_root",
    "documentation_url",
    "evidence_note"
   ],
   "properties": {
    "harness": {
     "enum": [
      "claude",
      "codex",
      "pi",
      "vibe"
     ]
    },
    "minimum_version": {
     "type": "string",
     "pattern": "^[0-9]+\\.[0-9]+\\.[0-9]+$",
     "description": "Floor. A release above it is supported without editing this file."
    },
    "probed_version": {
     "type": "string",
     "pattern": "^[0-9]+\\.[0-9]+\\.[0-9]+$",
     "description": "What the probe command actually returned on the pilot machine."
    },
    "probed_on": {
     "type": "string",
     "format": "date"
    },
    "probe_command": {
     "type": "string",
     "minLength": 1
    },
    "unknown_version_behavior": {
     "const": "refuse-install"
    },
    "below_minimum_behavior": {
     "const": "refuse-install"
    },
    "skills_root": {
     "type": "string",
     "minLength": 1,
     "description": "The user-level directory this harness scans for skills."
    },
    "project_skill_roots": {
     "type": "array",
     "items": {"type": "string", "minLength": 1},
     "description": "Project-relative directories this harness scans for skills; read by yawn check 14."
    },
    "documentation_url": {
     "type": "string",
     "format": "uri"
    },
    "evidence_note": {
     "type": "string",
     "minLength": 1
    }
   }
  },
  "assertion": {
   "type": "object",
   "additionalProperties": false,
   "required": [
    "id",
    "slice",
    "harness",
    "harness_version",
    "assertion",
    "source_concept",
    "native_expression",
    "disposition",
    "evidence_kind",
    "test",
    "result"
   ],
   "properties": {
    "id": {
     "type": "string",
     "pattern": "^[a-z0-9-]+$"
    },
    "slice": {
     "type": "string",
     "minLength": 1
    },
    "harness": {
     "enum": [
      "claude",
      "codex",
      "pi",
      "vibe",
      "all"
     ]
    },
    "harness_version": {
     "type": "string",
     "minLength": 1
    },
    "assertion": {
     "type": "string",
     "minLength": 1
    },
    "source_concept": {
     "type": "string",
     "minLength": 1,
     "description": "The thing being translated, named once in harness-neutral words."
    },
    "native_expression": {
     "type": "string",
     "minLength": 1,
     "description": "How this harness spells that concept."
    },
    "disposition": {
     "enum": [
      "shared",
      "harness-specific",
      "manual-only"
     ],
     "description": "shared: the same expression serves at least two harnesses. harness-specific: a one-off, deliberately left in its adapter. manual-only: no automated evidence is possible."
    },
    "evidence_kind": {
     "enum": [
      "static-test",
      "local-probe",
      "documentation",
      "manual-smoke"
     ],
     "description": "local-probe: a real CLI answered, offline and with no model call, under both a negative and a positive control."
    },
    "test": {
     "type": "string",
     "minLength": 1,
     "description": "A pytest nodeid for static-test and local-probe; the procedure to run for manual-smoke; the citation for documentation."
    },
    "result": {
     "enum": [
      "pass",
      "pending"
     ]
    }
   }
  }
 }
}
