{
  "schema_version": 1,
  "canonical_sources": {
    "perch": "skills/perch/SKILL.md",
    "yawn": "skills/yawn/SKILL.md",
    "dirty-reset-guard": "scripts/guard-destructive-bash.sh"
  },
  "versions": [
    {
      "harness": "claude",
      "minimum_version": "2.1.0",
      "probed_version": "2.1.273",
      "probed_on": "2026-09-16",
      "probe_command": "claude --version",
      "unknown_version_behavior": "refuse-install",
      "below_minimum_behavior": "refuse-install",
      "skills_root": "$HOME/.claude/skills",
      "documentation_url": "https://code.claude.com/docs/en/skills",
      "evidence_note": "perch has been live in this harness across the 2.1 series, which is the floor; 2.1.273 is what the probe returned on the pilot machine. Claude Code reads only its own skills root -- it does not scan $HOME/.agents -- so the neutral home creates no duplicate perch for it. A floor rather than an allowlist: PR #780 enumerated supported versions and refused two of the three installed CLIs nine days later."
    },
    {
      "harness": "codex",
      "minimum_version": "0.154.0",
      "probed_version": "0.154.0",
      "probed_on": "2026-09-16",
      "probe_command": "codex --version",
      "unknown_version_behavior": "refuse-install",
      "below_minimum_behavior": "refuse-install",
      "skills_root": "$HOME/.agents/skills",
      "documentation_url": "https://learn.chatgpt.com/docs/build-skills",
      "evidence_note": "0.154.0 is the only Codex build this pilot observed, so it is the floor: a version below it was never tested and is refused rather than assumed. Upstream documents $HOME/.agents/skills as the user-level skills root and states that symlinked skill folders are followed."
    },
    {
      "harness": "pi",
      "minimum_version": "0.85.1",
      "probed_version": "0.85.1",
      "probed_on": "2026-09-16",
      "probe_command": "pi --version",
      "unknown_version_behavior": "refuse-install",
      "below_minimum_behavior": "refuse-install",
      "skills_root": "$HOME/.agents/skills",
      "documentation_url": "https://github.com/earendil-works/pi/blob/main/packages/coding-agent/docs/skills.md",
      "evidence_note": "Installed for this pilot with `npm install -g --ignore-scripts @earendil-works/pi-coding-agent` (0.85.1) and exposed on PATH by a symlink beside the existing node/npm ones. The authoritative product is the pi.dev coding agent, npm @earendil-works/pi-coding-agent, GitHub earendil-works/pi, config home ~/.pi/agent; the similarly named @mariozechner/pi-coding-agent is deprecated upstream in favour of it. Its shipped docs/skills.md lists ~/.agents/skills/ as a global skill location."
    },
    {
      "harness": "vibe",
      "minimum_version": "2.25.8",
      "probed_version": "2.25.8",
      "probed_on": "2026-09-28",
      "probe_command": "vibe --version",
      "unknown_version_behavior": "refuse-install",
      "below_minimum_behavior": "refuse-install",
      "skills_root": "$HOME/.vibe/skills and $HOME/.agents/skills (both user-level)",
      "documentation_url": "https://docs.mistral.ai/vibe/code/overview",
      "evidence_note": "Fourth target per the 2026-09-28 amendment to 0800. Version probe verified on the pilot machine. Skills roots per Vibe's own documented search order (project .vibe/skills, .agents/skills, then user ~/.vibe/skills, ~/.agents/skills); the neutral ~/.agents/skills root is shared with Codex and Pi, so the perch and healthcheck symlinks are already discoverable there. NO porting slice has run on Vibe: this entry claims a version probe and skills-root compatibility only, never behavioral support. The recorded decision (0810) names Vibe as the next manual slice."
    }
  ],
  "assertions": [
    {
      "id": "canonical-body-is-single-and-live",
      "slice": "perch",
      "harness": "all",
      "harness_version": "claude 2.1.273, codex 0.154.0, pi 0.85.1",
      "assertion": "One Markdown body serves all three harnesses, read in place with no build step and no second copy.",
      "source_concept": "workflow body",
      "native_expression": "skills/perch/SKILL.md, reached directly or through a symlink",
      "disposition": "shared",
      "evidence_kind": "static-test",
      "test": "tests/test_perch_pilot.py::test_the_canonical_body_is_the_only_workflow_text",
      "result": "pass"
    },
    {
      "id": "shared-frontmatter-core",
      "slice": "perch",
      "harness": "all",
      "harness_version": "claude 2.1.273, codex 0.154.0, pi 0.85.1",
      "assertion": "name and description are the entire intersection of what the three harnesses require, and the canonical frontmatter already carries both -- so this slice promotes no new core identifier. Claude's user-invocable and argument-hint keys are unknown to the other two and are ignored, not rejected.",
      "source_concept": "skill identity metadata",
      "native_expression": "SKILL.md frontmatter: name, description",
      "disposition": "shared",
      "evidence_kind": "static-test",
      "test": "tests/test_perch_pilot.py::test_the_canonical_frontmatter_carries_what_all_three_harnesses_require",
      "result": "pass"
    },
    {
      "id": "stable-output-headings",
      "slice": "perch",
      "harness": "all",
      "harness_version": "claude 2.1.273, codex 0.154.0, pi 0.85.1",
      "assertion": "The read-only workflow and the Done / Open / optional Drift / Stance output shape come from the one body, so they cannot diverge per harness.",
      "source_concept": "output shape",
      "native_expression": "headings defined once in skills/perch/SKILL.md",
      "disposition": "shared",
      "evidence_kind": "static-test",
      "test": "tests/test_perch_pilot.py::test_the_output_headings_are_stable_and_the_workflow_is_read_only",
      "result": "pass"
    },
    {
      "id": "claude-needs-no-projection",
      "slice": "perch",
      "harness": "claude",
      "harness_version": "2.1.273",
      "assertion": "In this installation the harness checkout is $HOME/.claude until the 0986 cutover (runbook: docs/idh-cutover-checklist.md), so the canonical directory already is the one Claude Code scans. Install reports it discoverable and creates nothing; where the repository lives elsewhere it creates a symlink instead.",
      "source_concept": "skill discovery",
      "native_expression": "$HOME/.claude/skills/perch",
      "disposition": "harness-specific",
      "evidence_kind": "static-test",
      "test": "tests/test_perch_pilot.py::test_claude_needs_no_projection_when_the_repo_is_the_claude_home",
      "result": "pass"
    },
    {
      "id": "claude-other-checkout-is-named-not-clobbered",
      "slice": "perch",
      "harness": "claude",
      "harness_version": "2.1.273",
      "assertion": "Run from a git worktree, the canonical source is the worktree's copy while the Claude skills root still holds the primary checkout's. Install refuses, and the refusal names that situation rather than reporting the unmanaged-entry collision.",
      "source_concept": "skill discovery",
      "native_expression": "$HOME/.claude/skills/perch, projection: other-checkout",
      "disposition": "harness-specific",
      "evidence_kind": "static-test",
      "test": "tests/test_perch_pilot.py::test_another_checkouts_perch_is_named_as_such_not_clobbered",
      "result": "pass"
    },
    {
      "id": "claude-personal-skill-discovery",
      "slice": "perch",
      "harness": "claude",
      "harness_version": "2.1.303",
      "assertion": "A clean Claude Code profile does not list perch; after install it appears in the initialization command list with its canonical description. No user prompt or model request is sent; the temporary profile has no inherited credentials and its API endpoint is disabled.",
      "source_concept": "skill discovery",
      "native_expression": "$HOME/.claude/skills/perch",
      "disposition": "harness-specific",
      "evidence_kind": "local-probe",
      "test": "tests/test_perch_discovery.py::test_a_clean_claude_profile_gains_perch_only_after_install",
      "result": "pass"
    },
    {
      "id": "codex-neutral-home-discovery",
      "slice": "perch",
      "harness": "codex",
      "harness_version": "0.154.0",
      "assertion": "A clean Codex profile does not list perch; after install it appears in the model-visible prompt's skills block. Probed offline, with no model call, against a throwaway $HOME.",
      "source_concept": "skill discovery",
      "native_expression": "$HOME/.agents/skills/perch",
      "disposition": "shared",
      "evidence_kind": "local-probe",
      "test": "tests/test_perch_discovery.py::test_a_clean_codex_profile_gains_perch_only_after_install",
      "result": "pass"
    },
    {
      "id": "pi-neutral-home-discovery",
      "slice": "perch",
      "harness": "pi",
      "harness_version": "0.85.1",
      "assertion": "A clean Pi profile does not list skill:perch; after install its get_commands answer carries it with the canonical description verbatim.",
      "source_concept": "skill discovery",
      "native_expression": "$HOME/.agents/skills/perch",
      "disposition": "shared",
      "evidence_kind": "local-probe",
      "test": "tests/test_perch_discovery.py::test_a_clean_pi_profile_gains_perch_only_after_install",
      "result": "pass"
    },
    {
      "id": "symlinked-skill-directory-is-followed",
      "slice": "perch",
      "harness": "pi",
      "harness_version": "0.85.1",
      "assertion": "The skill directory under the neutral home is a symlink onto the repository, and the harness resolves through it to the canonical SKILL.md. This is what keeps the body live with no build step and no copy.",
      "source_concept": "canonical body indirection",
      "native_expression": "$HOME/.agents/skills/perch -> <repo>/skills/perch",
      "disposition": "shared",
      "evidence_kind": "local-probe",